{"authority":"nxb-native-impact-policy-v1","classification_precedence":["native_required","hosted_authority_only","non_authority_metadata"],"dependency_edges":[{"reason_code":"native_validator_dependency","source":"validation/v11/scripts/Invoke-NxbV11CompatibilityNativeValidation.ps1","target":"validation/v11/tools/validate_v11_compatibility.py"},{"reason_code":"native_schema_dependency","source":"validation/v11/scripts/Invoke-NxbV11CompatibilityNativeValidation.ps1","target":"schemas/nxb-v11-environment-fingerprint.schema.json"},{"reason_code":"classifier_policy_dependency","source":"validation/v11/tools/classify_native_impact.py","target":"config/nxb-native-impact-policy.json"}],"forbidden_broad_patterns":["*.json","*.md","config/**","docs/**","schemas/**","validation/v11/**"],"hosted_authority_only_roots":[{"match_type":"prefix","path":"docs/hosted-authority-fixture/","reason_code":"fixture_hosted_authority_only","rule_id":"fixture-hosted-docs"}],"limits":{"max_changed_paths":256,"max_dependency_edges":4096,"max_graph_nodes":4096},"native_roots":[{"match_type":"prefix","path":".github/workflows/","reason_code":"workflow_orchestration","rule_id":"workflow-root"},{"match_type":"prefix","path":"config/","reason_code":"authority_config","rule_id":"config-root"},{"match_type":"prefix","path":"schemas/","reason_code":"authority_schema","rule_id":"schema-root"},{"match_type":"prefix","path":"scripts/","reason_code":"runtime_script","rule_id":"runtime-script-root"},{"match_type":"prefix","path":"tools/","reason_code":"authority_tool","rule_id":"top-tool-root"},{"match_type":"prefix","path":"tests/","reason_code":"acceptance_test","rule_id":"top-test-root"},{"match_type":"prefix","path":"profiles/","reason_code":"wpt_profile","rule_id":"profile-root"},{"match_type":"prefix","path":"validation/v11/scripts/","reason_code":"v11_native_harness","rule_id":"v11-script-root"},{"match_type":"prefix","path":"validation/v11/tools/","reason_code":"v11_validator_tool","rule_id":"v11-tool-root"},{"match_type":"prefix","path":"validation/v11/tests/","reason_code":"v11_acceptance_test","rule_id":"v11-test-root"},{"match_type":"prefix","path":"validation/v11/locks/","reason_code":"dependency_lock","rule_id":"v11-lock-root"},{"match_type":"prefix","path":"validation/v11/fixtures/native-runtime/","reason_code":"native_fixture","rule_id":"native-runtime-fixture-root"},{"match_type":"prefix","path":"validation/v11/fixtures/compatibility-artifact/","reason_code":"authority_fixture","rule_id":"compat-artifact-fixture-root"},{"match_type":"prefix","path":"validation/v11/fixtures/known-error/","reason_code":"known_error_fixture","rule_id":"known-error-fixture-root"},{"match_type":"prefix","path":"validation/v11/fixtures/native-impact-classifier/","reason_code":"classifier_fixture","rule_id":"classifier-fixture-root"},{"match_type":"exact","path":"AGENTS.md","reason_code":"authority_document","rule_id":"agents-authority"},{"match_type":"prefix","path":"docs/NXB-V1","reason_code":"authority_document","rule_id":"v1-doc-authority"}],"non_authority_metadata_roots":[{"match_type":"prefix","path":"docs/non-authority-fixture/","reason_code":"fixture_non_authority_metadata","rule_id":"fixture-non-authority-docs"}],"policy_version":1,"schema_version":1}